{
  "schema_version": "2.0.0",
  "evidence_id": "EVID-EVT-0002",
  "capability_id": "CAP-OFFLINE-CONTINUITY",
  "contract_id": "S-001A-CONTRACT",
  "implementation_id": "local-runner-v1",
  "execution_id": "local-s001a-20260819",
  "fixture_hash": "sha256:7c2ebd98d14b0bae3ccac329cfaf0fa93ecf3df6a065f4dcfae3ce3ae4b10822",
  "input_hash": "sha256:7c2ebd98d14b0bae3ccac329cfaf0fa93ecf3df6a065f4dcfae3ce3ae4b10822",
  "output_hash": "sha256:43dcc00cdf143705e2502e8a3399f32d38042764854b9b3e2424b1e5b39cd975",
  "evidence_hash": "sha256:102f15ab0c4475bf847db5e7d2397d565a99f3577327711a3d9159f10bccfeec",
  "scope": "LOCAL",
  "review_status": "REVIEW_PENDING",
  "claim_boundary": "LOCAL_SCOPED",
  "rollback_reference": "local-s001a-rollback",
  "assurance": {
    "oneD": true,
    "oneV": false,
    "oneR": false,
    "oneA": false
  }
}
